{
  "$schema": "./UNI_SOURCE_RECORD_SCHEMA_G1.json",
  "schema_version": "G1",
  "lot_id": "G1-FONDAMENTI-GUTENBERG-RAW",
  "scope": {
    "root_path": "Fondamenti_Pack/raw/gutenberg",
    "selection_rule": "I 14 file .txt locali del sottoinsieme classici indicato da GUTENBERG-CLASSICI nei registri del pack.",
    "excluded_paths": [
      "Fondamenti_Pack/parsed",
      "Fondamenti_Pack/COURSE.yaml",
      "Fondamenti_Pack/README.md",
      "UNIVERSITA_EDILIZIA/ESAMI"
    ]
  },
  "observed_at": "2026-10-17",
  "records": [
    {
      "record_id": "G1-001",
      "source_kind": "public_domain_work",
      "title": "The Nicomachean Ethics",
      "author": "Aristotle (tr. W. D. Ross)",
      "locator": {
        "path": "Fondamenti_Pack/raw/gutenberg/Aristotle_Ethics_pg8438.txt",
        "url": "https://www.gutenberg.org/ebooks/8438"
      },
      "version_date": {
        "value": "1925",
        "kind": "publication_year",
        "basis": "Fondamenti_Pack/parsed/classici_fondamenti.jsonl record metadata"
      },
      "hash": {
        "algorithm": "SHA-256",
        "value": "A68264A6537BB58B899ED68E25D1C7D8EA1BCB3E9544B4D1B464F74D99C3D059"
      },
      "license": {
        "label": "Public domain",
        "basis_path": "Fondamenti_Pack/licenze_audit.json",
        "basis_selector": "fonti[id=GUTENBERG-CLASSICI]",
        "local_statement": "Public domain (opere pubblicate prima del 1930; traduzioni antiche)"
      },
      "attribution": "The Nicomachean Ethics, Aristotle (tr. W. D. Ross) (1925) - public domain",
      "transformation": {
        "status": "source_preserving",
        "description": "Il lotto registra il file raw esistente; nessuna nuova trasformazione o copia di testo è stata applicata."
      },
      "verification_status": {
        "state": "observed_local",
        "checked_at": "2026-10-17",
        "checks": [
          "local_file_exists",
          "sha256_recomputed",
          "metadata_cross_checked_against_local_manifest_and_parsed_record"
        ],
        "not_checked": [
          "external_url_availability",
          "current_license_terms",
          "independent_legal_public_domain_status"
        ]
      },
      "limitations": [
        "La licenza è riportata come dichiarazione osservata nei file locali e non come parere giuridico indipendente.",
        "Il record non contiene il testo della fonte né una validazione di accuratezza o completezza.",
        "L'anno è il metadato locale della pubblicazione/opera, non una revisione del file raw."
      ]
    },
    {
      "record_id": "G1-002",
      "source_kind": "public_domain_work",
      "title": "Calculus Made Easy",
      "author": "Silvanus P. Thompson",
      "locator": {
        "path": "Fondamenti_Pack/raw/gutenberg/Calculus_Made_Easy_Thompson.txt",
        "url": "https://archive.org/details/in.ernet.dli.2015.94125"
      },
      "version_date": {
        "value": "1914",
        "kind": "publication_year",
        "basis": "Fondamenti_Pack/parsed/classici_fondamenti.jsonl record metadata"
      },
      "hash": {
        "algorithm": "SHA-256",
        "value": "C24B6E367D112398B488AAF61BE728EC125E3B251212BA98CEFFB73FD9ADBF0F"
      },
      "license": {
        "label": "Public domain",
        "basis_path": "Fondamenti_Pack/licenze_audit.json",
        "basis_selector": "fonti[id=GUTENBERG-CLASSICI]",
        "local_statement": "Public domain (opere pubblicate prima del 1930; traduzioni antiche)"
      },
      "attribution": "Calculus Made Easy, Silvanus P. Thompson (1914) - public domain",
      "transformation": {
        "status": "source_preserving",
        "description": "Il lotto registra il file raw esistente; nessuna nuova trasformazione o copia di testo è stata applicata."
      },
      "verification_status": {
        "state": "observed_local",
        "checked_at": "2026-10-17",
        "checks": [
          "local_file_exists",
          "sha256_recomputed",
          "metadata_cross_checked_against_local_manifest_and_parsed_record"
        ],
        "not_checked": [
          "external_url_availability",
          "current_license_terms",
          "independent_legal_public_domain_status"
        ]
      },
      "limitations": [
        "La licenza è riportata come dichiarazione osservata nei file locali e non come parere giuridico indipendente.",
        "Il record non contiene il testo della fonte né una validazione di accuratezza o completezza.",
        "L'anno è il metadato locale della pubblicazione/opera, non una revisione del file raw."
      ]
    },
    {
      "record_id": "G1-003",
      "source_kind": "public_domain_work",
      "title": "Discourse on the Method",
      "author": "René Descartes",
      "locator": {
        "path": "Fondamenti_Pack/raw/gutenberg/Descartes_Discourse_pg59.txt",
        "url": "https://www.gutenberg.org/ebooks/59"
      },
      "version_date": {
        "value": "1637",
        "kind": "publication_year",
        "basis": "Fondamenti_Pack/parsed/classici_fondamenti.jsonl record metadata"
      },
      "hash": {
        "algorithm": "SHA-256",
        "value": "7768BA8D3895BE3D6F1492733FFAB983D69875CC743EDD23A1840E1530D02924"
      },
      "license": {
        "label": "Public domain",
        "basis_path": "Fondamenti_Pack/licenze_audit.json",
        "basis_selector": "fonti[id=GUTENBERG-CLASSICI]",
        "local_statement": "Public domain (opere pubblicate prima del 1930; traduzioni antiche)"
      },
      "attribution": "Discourse on the Method, René Descartes (1637) - public domain",
      "transformation": {
        "status": "source_preserving",
        "description": "Il lotto registra il file raw esistente; nessuna nuova trasformazione o copia di testo è stata applicata."
      },
      "verification_status": {
        "state": "observed_local",
        "checked_at": "2026-10-17",
        "checks": [
          "local_file_exists",
          "sha256_recomputed",
          "metadata_cross_checked_against_local_manifest_and_parsed_record"
        ],
        "not_checked": [
          "external_url_availability",
          "current_license_terms",
          "independent_legal_public_domain_status"
        ]
      },
      "limitations": [
        "La licenza è riportata come dichiarazione osservata nei file locali e non come parere giuridico indipendente.",
        "Il record non contiene il testo della fonte né una validazione di accuratezza o completezza.",
        "L'anno è il metadato locale della pubblicazione/opera, non una revisione del file raw."
      ]
    },
    {
      "record_id": "G1-004",
      "source_kind": "public_domain_work",
      "title": "Relativity: The Special and General Theory",
      "author": "Albert Einstein (tr. Robert W. Lawson)",
      "locator": {
        "path": "Fondamenti_Pack/raw/gutenberg/Einstein_Relativity_pg30155.txt",
        "url": "https://www.gutenberg.org/ebooks/30155"
      },
      "version_date": {
        "value": "1920",
        "kind": "publication_year",
        "basis": "Fondamenti_Pack/parsed/classici_fondamenti.jsonl record metadata"
      },
      "hash": {
        "algorithm": "SHA-256",
        "value": "86ED8156239455CBB6ED33E06097707D3AB7C40D46E9AA5FF32D3C3F94EF68FD"
      },
      "license": {
        "label": "Public domain",
        "basis_path": "Fondamenti_Pack/licenze_audit.json",
        "basis_selector": "fonti[id=GUTENBERG-CLASSICI]",
        "local_statement": "Public domain (opere pubblicate prima del 1930; traduzioni antiche)"
      },
      "attribution": "Relativity: The Special and General Theory, Albert Einstein (tr. Robert W. Lawson) (1920) - public domain",
      "transformation": {
        "status": "source_preserving",
        "description": "Il lotto registra il file raw esistente; nessuna nuova trasformazione o copia di testo è stata applicata."
      },
      "verification_status": {
        "state": "observed_local",
        "checked_at": "2026-10-17",
        "checks": [
          "local_file_exists",
          "sha256_recomputed",
          "metadata_cross_checked_against_local_manifest_and_parsed_record"
        ],
        "not_checked": [
          "external_url_availability",
          "current_license_terms",
          "independent_legal_public_domain_status"
        ]
      },
      "limitations": [
        "La licenza è riportata come dichiarazione osservata nei file locali e non come parere giuridico indipendente.",
        "Il record non contiene il testo della fonte né una validazione di accuratezza o completezza.",
        "L'anno è il metadato locale della pubblicazione/opera, non una revisione del file raw."
      ]
    },
    {
      "record_id": "G1-005",
      "source_kind": "public_domain_work",
      "title": "The Elements of Euclid",
      "author": "Euclid (ed. school edition)",
      "locator": {
        "path": "Fondamenti_Pack/raw/gutenberg/Euclid_Elements.txt",
        "url": "https://archive.org/details/elementsofeuclid00eucl_0"
      },
      "version_date": {
        "value": "1882",
        "kind": "publication_year",
        "basis": "Fondamenti_Pack/parsed/classici_fondamenti.jsonl record metadata"
      },
      "hash": {
        "algorithm": "SHA-256",
        "value": "A274721324564572153A54D31E94FB9A15E18481B71085293484750941799EDD"
      },
      "license": {
        "label": "Public domain",
        "basis_path": "Fondamenti_Pack/licenze_audit.json",
        "basis_selector": "fonti[id=GUTENBERG-CLASSICI]",
        "local_statement": "Public domain (opere pubblicate prima del 1930; traduzioni antiche)"
      },
      "attribution": "The Elements of Euclid, Euclid (ed. school edition) (1882) - public domain",
      "transformation": {
        "status": "source_preserving",
        "description": "Il lotto registra il file raw esistente; nessuna nuova trasformazione o copia di testo è stata applicata."
      },
      "verification_status": {
        "state": "observed_local",